{
  "type": "array",
  "$schema": "https://json-schema.org/draft/2020-12/schema",
  "items": {
    "type": "object",
    "required": [
      "alias",
      "id",
      "isEmpty",
      "isFavorite",
      "login",
      "src",
      "stm",
      "title",
      "updatedAt",
      "url"
    ],
    "properties": {
      "alias": {
        "type": "string"
      },
      "id": {
        "type": "integer"
      },
      "isEmpty": {
        "type": "boolean"
      },
      "isFavorite": {
        "type": "boolean"
      },
      "login": {
        "anyOf": [
          {
            "type": "string"
          },
          {
            "type": "null"
          }
        ]
      },
      "src": {
        "type": "string",
        "format": "uri"
      },
      "stm": {
        "type": "boolean"
      },
      "title": {
        "type": "string"
      },
      "updatedAt": {
        "anyOf": [
          {
            "type": "string",
            "anyOf": [
              {
                "type": "string"
              },
              {
                "type": "string",
                "format": "date-time"
              }
            ]
          },
          {
            "type": "null"
          }
        ]
      },
      "url": {
        "anyOf": [
          {
            "type": "string",
            "anyOf": [
              {
                "type": "string"
              },
              {
                "type": "string",
                "format": "uri"
              }
            ]
          },
          {
            "type": "null"
          }
        ]
      }
    }
  }
}